{
  "contract_version": 2,
  "github": "AccentCMS",
  "handle": "accentx",
  "identity_verified": true,
  "license_public_key": "-----BEGIN PUBLIC KEY-----\nMCowBQYDK2VwAyEAdSrfI8IBjUUnpApuuie3AtLrRQ/MmMwMEcEDN7Xcw2U=\n-----END PUBLIC KEY-----\n",
  "name": "AccentX",
  "url": "https://accentcms.dev"
}
